{
  "id": "I182613112788",
  "person": "Sir Knight John III,  High Sheriff of Northamptonshire, MEMBER of PARLIAMENT, Bernard III   Squire of Abington",
  "status": "seeded",
  "summary": null,
  "waypoints": [
    {
      "seq": 1,
      "place": {
        "raw": "Abington Manor, Abington, Northamptonshire, England",
        "parts": [
          "Abington Manor",
          "Abington",
          "Northamptonshire",
          "England"
        ],
        "lat": null,
        "lng": null
      },
      "date": {
        "raw": "1490",
        "year": 1490,
        "year_end": null,
        "qualifier": null
      },
      "event": "birth",
      "narrative": null,
      "confidence": "inferred",
      "sources": []
    },
    {
      "seq": 2,
      "place": {
        "raw": "Abington Manor, Abington, Northamptonshire, England",
        "parts": [
          "Abington Manor",
          "Abington",
          "Northamptonshire",
          "England"
        ],
        "lat": null,
        "lng": null
      },
      "date": {
        "raw": "4 Feb 1549",
        "year": 1549,
        "year_end": null,
        "qualifier": null
      },
      "event": "death",
      "narrative": null,
      "confidence": "inferred",
      "sources": []
    }
  ],
  "notes": null
}
