{
  "id": "I182650551777",
  "person": "Richard Church",
  "status": "seeded",
  "summary": null,
  "waypoints": [
    {
      "seq": 1,
      "place": {
        "raw": "England",
        "parts": [
          "England"
        ],
        "lat": null,
        "lng": null
      },
      "date": {
        "raw": "1608",
        "year": 1608,
        "year_end": null,
        "qualifier": null
      },
      "event": "birth",
      "narrative": null,
      "confidence": "inferred",
      "sources": []
    },
    {
      "seq": 2,
      "place": {
        "raw": "Dedham, Norfolk, Massachusetts, USA",
        "parts": [
          "Dedham",
          "Norfolk",
          "Massachusetts",
          "USA"
        ],
        "lat": null,
        "lng": null
      },
      "date": {
        "raw": "27 Dec 1668",
        "year": 1668,
        "year_end": null,
        "qualifier": null
      },
      "event": "death",
      "narrative": null,
      "confidence": "inferred",
      "sources": []
    }
  ],
  "notes": null
}
