{
  "id": "I182623694613",
  "person": "Richard Cooke",
  "status": "seeded",
  "summary": null,
  "waypoints": [
    {
      "seq": 1,
      "place": {
        "raw": "Eastham, Barnstable, Massachusetts, USA",
        "parts": [
          "Eastham",
          "Barnstable",
          "Massachusetts",
          "USA"
        ],
        "lat": null,
        "lng": null
      },
      "date": {
        "raw": "1 Sep 1672",
        "year": 1672,
        "year_end": null,
        "qualifier": null
      },
      "event": "birth",
      "narrative": null,
      "confidence": "inferred",
      "sources": []
    },
    {
      "seq": 2,
      "place": {
        "raw": "Eastham, Barnstable, Massachusetts, USA",
        "parts": [
          "Eastham",
          "Barnstable",
          "Massachusetts",
          "USA"
        ],
        "lat": null,
        "lng": null
      },
      "date": {
        "raw": "25 Apr 1754",
        "year": 1754,
        "year_end": null,
        "qualifier": null
      },
      "event": "death",
      "narrative": null,
      "confidence": "inferred",
      "sources": []
    }
  ],
  "notes": null
}
