{
  "id": "I182623679489",
  "person": "Lucy Cook",
  "status": "seeded",
  "summary": null,
  "waypoints": [
    {
      "seq": 1,
      "place": {
        "raw": "Arlington, Middlesex, Massachusetts",
        "parts": [
          "Arlington",
          "Middlesex",
          "Massachusetts"
        ],
        "lat": null,
        "lng": null
      },
      "date": {
        "raw": "19 Jul 1767",
        "year": 1767,
        "year_end": null,
        "qualifier": null
      },
      "event": "birth",
      "narrative": null,
      "confidence": "inferred",
      "sources": []
    },
    {
      "seq": 2,
      "place": {
        "raw": "Cambridge, Coos, New Hampshire, United States",
        "parts": [
          "Cambridge",
          "Coos",
          "New Hampshire",
          "United States"
        ],
        "lat": null,
        "lng": null
      },
      "date": {
        "raw": "7 Feb 1854",
        "year": 1854,
        "year_end": null,
        "qualifier": null
      },
      "event": "death",
      "narrative": null,
      "confidence": "inferred",
      "sources": []
    }
  ],
  "notes": null
}
