{
  "id": "I182613026294",
  "person": "Rev. Maurice Morris Johnson,  English Parliament member, Mayor Stamford, Esquire; Lascelles-Lassels) LACEY, Lacy)",
  "status": "seeded",
  "summary": null,
  "waypoints": [
    {
      "seq": 1,
      "place": {
        "raw": "Township of Stamford, Rutland County, England",
        "parts": [
          "Township of Stamford",
          "Rutland County",
          "England"
        ],
        "lat": null,
        "lng": null
      },
      "date": {
        "raw": "11 Feb 1500",
        "year": 1500,
        "year_end": null,
        "qualifier": null
      },
      "event": "birth",
      "narrative": null,
      "confidence": "inferred",
      "sources": []
    },
    {
      "seq": 2,
      "place": {
        "raw": "North Luffenham, Rutland, England",
        "parts": [
          "North Luffenham",
          "Rutland",
          "England"
        ],
        "lat": null,
        "lng": null
      },
      "date": {
        "raw": "26 Dec 1557",
        "year": 1557,
        "year_end": null,
        "qualifier": null
      },
      "event": "death",
      "narrative": null,
      "confidence": "inferred",
      "sources": []
    }
  ],
  "notes": null
}
