{
  "id": "I182541959347",
  "person": "Joseph Hibbard",
  "status": "seeded",
  "summary": null,
  "waypoints": [
    {
      "seq": 1,
      "place": {
        "raw": "Manchester, Mass, Massachusetts, USA",
        "parts": [
          "Manchester",
          "Mass",
          "Massachusetts",
          "USA"
        ],
        "lat": null,
        "lng": null
      },
      "date": {
        "raw": "23 April 1751",
        "year": 1751,
        "year_end": null,
        "qualifier": null
      },
      "event": "birth",
      "narrative": null,
      "confidence": "inferred",
      "sources": []
    }
  ],
  "notes": null
}
