{
  "id": "I182587609016",
  "person": "James \"Gems\" Carey (Mulkarey)",
  "status": "seeded",
  "summary": null,
  "waypoints": [
    {
      "seq": 1,
      "place": {
        "raw": "Ireland",
        "parts": [
          "Ireland"
        ],
        "lat": null,
        "lng": null
      },
      "date": {
        "raw": "1780",
        "year": 1780,
        "year_end": null,
        "qualifier": null
      },
      "event": "birth",
      "narrative": null,
      "confidence": "documented",
      "sources": [
        {
          "source_id": "",
          "page": null
        },
        {
          "source_id": "S513850796",
          "page": null
        },
        {
          "source_id": "S508118847",
          "page": null
        }
      ]
    },
    {
      "seq": 2,
      "place": {
        "raw": "Balrothery, Ireland",
        "parts": [
          "Balrothery",
          "Ireland"
        ],
        "lat": null,
        "lng": null
      },
      "date": {
        "raw": "1867",
        "year": 1867,
        "year_end": null,
        "qualifier": null
      },
      "event": "death",
      "narrative": null,
      "confidence": "documented",
      "sources": [
        {
          "source_id": "",
          "page": null
        },
        {
          "source_id": "S513850796",
          "page": null
        }
      ]
    }
  ],
  "notes": null
}
