{
  "id": "I182195860776",
  "person": "Maria Ählström",
  "status": "seeded",
  "summary": null,
  "waypoints": [
    {
      "seq": 1,
      "place": {
        "raw": "Borås, Älvsborg, Sweden",
        "parts": [
          "Borås",
          "Älvsborg",
          "Sweden"
        ],
        "lat": null,
        "lng": null
      },
      "date": {
        "raw": "22 Dec",
        "year": null,
        "year_end": null,
        "qualifier": null
      },
      "event": "birth",
      "narrative": null,
      "confidence": "inferred",
      "sources": []
    }
  ],
  "notes": null
}
