{
  "id": "I182613118170",
  "person": "Johanna Jane Halliwell Dame, Baroness Bray",
  "status": "seeded",
  "summary": null,
  "waypoints": [
    {
      "seq": 1,
      "place": {
        "raw": "Bray, Eaton, Bedfordshire, England",
        "parts": [
          "Bray",
          "Eaton",
          "Bedfordshire",
          "England"
        ],
        "lat": null,
        "lng": null
      },
      "date": {
        "raw": "1484",
        "year": 1484,
        "year_end": null,
        "qualifier": null
      },
      "event": "birth",
      "narrative": null,
      "confidence": "inferred",
      "sources": []
    },
    {
      "seq": 2,
      "place": {
        "raw": "Eaton Bray, Central Bedfordshire Unitary Authority, Bedfordshire, England",
        "parts": [
          "Eaton Bray",
          "Central Bedfordshire Unitary Authority",
          "Bedfordshire",
          "England"
        ],
        "lat": null,
        "lng": null
      },
      "date": {
        "raw": "24 October 1558",
        "year": 1558,
        "year_end": null,
        "qualifier": null
      },
      "event": "death",
      "narrative": null,
      "confidence": "inferred",
      "sources": []
    }
  ],
  "notes": null
}
