{
  "id": "I182381534234",
  "person": "Partner_geerlof) Noorlander",
  "status": "seeded",
  "summary": null,
  "waypoints": [
    {
      "seq": 1,
      "place": {
        "raw": "Netherlands, Pays-Bas",
        "parts": [
          "Netherlands",
          "Pays-Bas"
        ],
        "lat": null,
        "lng": null
      },
      "date": {
        "raw": "ABT 1505",
        "year": 1505,
        "year_end": null,
        "qualifier": "ABT"
      },
      "event": "birth",
      "narrative": null,
      "confidence": "inferred",
      "sources": []
    }
  ],
  "notes": null
}
