{
  "id": "I182625292213",
  "person": "Cornelius Hierlihy Lt. Col",
  "status": "seeded",
  "summary": null,
  "waypoints": [
    {
      "seq": 1,
      "place": {
        "raw": "Mallow, Cork, Ireland",
        "parts": [
          "Mallow",
          "Cork",
          "Ireland"
        ],
        "lat": null,
        "lng": null
      },
      "date": {
        "raw": "1720",
        "year": 1720,
        "year_end": null,
        "qualifier": null
      },
      "event": "birth",
      "narrative": null,
      "confidence": "inferred",
      "sources": []
    },
    {
      "seq": 2,
      "place": {
        "raw": "Town Point, Provence, Nova Scotia, Canada",
        "parts": [
          "Town Point",
          "Provence",
          "Nova Scotia",
          "Canada"
        ],
        "lat": null,
        "lng": null
      },
      "date": null,
      "event": "death",
      "narrative": null,
      "confidence": "inferred",
      "sources": []
    }
  ],
  "notes": null
}
