{
  "id": "I182650552492",
  "person": "Jacob Decoster",
  "status": "seeded",
  "summary": null,
  "waypoints": [
    {
      "seq": 1,
      "place": {
        "raw": "Bridgewater,Plymouth,Massachusetts,USA",
        "parts": [
          "Bridgewater",
          "Plymouth",
          "Massachusetts",
          "USA"
        ],
        "lat": null,
        "lng": null
      },
      "date": {
        "raw": "1746",
        "year": 1746,
        "year_end": null,
        "qualifier": null
      },
      "event": "birth",
      "narrative": null,
      "confidence": "inferred",
      "sources": []
    },
    {
      "seq": 2,
      "place": {
        "raw": "Hebron,Oxford,Maine,USA",
        "parts": [
          "Hebron",
          "Oxford",
          "Maine",
          "USA"
        ],
        "lat": null,
        "lng": null
      },
      "date": {
        "raw": "1830-08-04",
        "year": 1830,
        "year_end": null,
        "qualifier": null
      },
      "event": "death",
      "narrative": null,
      "confidence": "inferred",
      "sources": []
    }
  ],
  "notes": null
}
