{
  "id": "I182650552168",
  "person": "Lady Elizabeth Margaret Alabaster, Allen",
  "status": "seeded",
  "summary": null,
  "waypoints": [
    {
      "seq": 1,
      "place": {
        "raw": "Wix, Essex, England",
        "parts": [
          "Wix",
          "Essex",
          "England"
        ],
        "lat": null,
        "lng": null
      },
      "date": {
        "raw": "1538",
        "year": 1538,
        "year_end": null,
        "qualifier": null
      },
      "event": "birth",
      "narrative": null,
      "confidence": "inferred",
      "sources": []
    },
    {
      "seq": 2,
      "place": {
        "raw": "Goldington, Bedfordshire, England",
        "parts": [
          "Goldington",
          "Bedfordshire",
          "England"
        ],
        "lat": null,
        "lng": null
      },
      "date": {
        "raw": "5 Sep 1568",
        "year": 1568,
        "year_end": null,
        "qualifier": null
      },
      "event": "death",
      "narrative": null,
      "confidence": "inferred",
      "sources": []
    }
  ],
  "notes": null
}
