{
  "id": "I182381537779",
  "person": "Mercy Oakley - Fowler",
  "status": "seeded",
  "summary": null,
  "waypoints": [
    {
      "seq": 1,
      "place": {
        "raw": "Westchester, New York",
        "parts": [
          "Westchester",
          "New York"
        ],
        "lat": null,
        "lng": null
      },
      "date": {
        "raw": "1697",
        "year": 1697,
        "year_end": null,
        "qualifier": null
      },
      "event": "birth",
      "narrative": null,
      "confidence": "inferred",
      "sources": []
    },
    {
      "seq": 2,
      "place": {
        "raw": "White Plains, New York, USA",
        "parts": [
          "White Plains",
          "New York",
          "USA"
        ],
        "lat": null,
        "lng": null
      },
      "date": {
        "raw": "23 MAY 1762",
        "year": 1762,
        "year_end": null,
        "qualifier": null
      },
      "event": "death",
      "narrative": null,
      "confidence": "inferred",
      "sources": []
    }
  ],
  "notes": null
}
