{
  "id": "I182584905624",
  "person": "Thomas Larkin",
  "status": "seeded",
  "summary": null,
  "waypoints": [
    {
      "seq": 1,
      "place": {
        "raw": "Co Galway",
        "parts": [
          "Co Galway"
        ],
        "lat": null,
        "lng": null
      },
      "date": {
        "raw": "1825",
        "year": 1825,
        "year_end": null,
        "qualifier": null
      },
      "event": "birth",
      "narrative": null,
      "confidence": "documented",
      "sources": [
        {
          "source_id": "S446914557",
          "page": "Ancestry Family Tree"
        },
        {
          "source_id": "S516021907",
          "page": null
        },
        {
          "source_id": "S513880151",
          "page": null
        },
        {
          "source_id": "S516918987",
          "page": null
        },
        {
          "source_id": "S506435674",
          "page": "National Library of Ireland; Dublin, Ireland; Irish Catholic Parish Registers; Microfilm Number: Microfilm 02433 / 16"
        },
        {
          "source_id": "S516919036",
          "page": "Class: RG14"
        }
      ]
    },
    {
      "seq": 2,
      "place": {
        "raw": "Galway, Ireland",
        "parts": [
          "Galway",
          "Ireland"
        ],
        "lat": null,
        "lng": null
      },
      "date": {
        "raw": "14 Jul 1839",
        "year": 1839,
        "year_end": null,
        "qualifier": null
      },
      "event": "baptism",
      "narrative": null,
      "confidence": "documented",
      "sources": [
        {
          "source_id": "S506435674",
          "page": "National Library of Ireland; Dublin, Ireland; Irish Catholic Parish Registers; Microfilm Number: Microfilm 02433 / 16"
        }
      ]
    },
    {
      "seq": 3,
      "place": {
        "raw": "Liverpool, Lancashire",
        "parts": [
          "Liverpool",
          "Lancashire"
        ],
        "lat": null,
        "lng": null
      },
      "date": {
        "raw": "23 Nov 1851",
        "year": 1851,
        "year_end": null,
        "qualifier": null
      },
      "event": "marriage",
      "narrative": null,
      "confidence": "documented",
      "sources": [
        {
          "source_id": "S446914557",
          "page": "Ancestry Family Tree"
        }
      ]
    },
    {
      "seq": 4,
      "place": {
        "raw": "Barton, Barton, Washington, Wisconsin, USA",
        "parts": [
          "Barton",
          "Barton",
          "Washington",
          "Wisconsin",
          "USA"
        ],
        "lat": null,
        "lng": null
      },
      "date": {
        "raw": "1860",
        "year": 1860,
        "year_end": null,
        "qualifier": null
      },
      "event": "residence",
      "narrative": null,
      "confidence": "inferred",
      "sources": []
    },
    {
      "seq": 5,
      "place": {
        "raw": "St Alban, Liverpool, Lancashire, England",
        "parts": [
          "St Alban",
          "Liverpool",
          "Lancashire",
          "England"
        ],
        "lat": null,
        "lng": null
      },
      "date": {
        "raw": "1861",
        "year": 1861,
        "year_end": null,
        "qualifier": null
      },
      "event": "residence",
      "narrative": null,
      "confidence": "documented",
      "sources": [
        {
          "source_id": "S516918987",
          "page": null
        }
      ]
    },
    {
      "seq": 6,
      "place": {
        "raw": "St Alban, Lancashire, England",
        "parts": [
          "St Alban",
          "Lancashire",
          "England"
        ],
        "lat": null,
        "lng": null
      },
      "date": {
        "raw": "1871",
        "year": 1871,
        "year_end": null,
        "qualifier": null
      },
      "event": "residence",
      "narrative": null,
      "confidence": "documented",
      "sources": [
        {
          "source_id": "S513880151",
          "page": null
        }
      ]
    },
    {
      "seq": 7,
      "place": {
        "raw": "Liverpool, Lancashire, England",
        "parts": [
          "Liverpool",
          "Lancashire",
          "England"
        ],
        "lat": null,
        "lng": null
      },
      "date": {
        "raw": "1881",
        "year": 1881,
        "year_end": null,
        "qualifier": null
      },
      "event": "residence",
      "narrative": null,
      "confidence": "documented",
      "sources": [
        {
          "source_id": "S516021907",
          "page": null
        }
      ]
    },
    {
      "seq": 8,
      "place": {
        "raw": "Lancashire, United Kingdom",
        "parts": [
          "Lancashire",
          "United Kingdom"
        ],
        "lat": null,
        "lng": null
      },
      "date": {
        "raw": "14 Nov 1898",
        "year": 1898,
        "year_end": null,
        "qualifier": null
      },
      "event": "death",
      "narrative": null,
      "confidence": "documented",
      "sources": [
        {
          "source_id": "S446914557",
          "page": "Ancestry Family Tree"
        }
      ]
    },
    {
      "seq": 9,
      "place": {
        "raw": "Muckanagh, Meelick, Galway, Ireland",
        "parts": [
          "Muckanagh",
          "Meelick",
          "Galway",
          "Ireland"
        ],
        "lat": null,
        "lng": null
      },
      "date": {
        "raw": "31 Mar 1901",
        "year": 1901,
        "year_end": null,
        "qualifier": null
      },
      "event": "residence",
      "narrative": null,
      "confidence": "documented",
      "sources": [
        {
          "source_id": "S516919036",
          "page": "Class: RG14"
        }
      ]
    }
  ],
  "notes": null
}
