{
  "id": "I182613116842",
  "person": "Edward II",
  "status": "seeded",
  "summary": null,
  "waypoints": [
    {
      "seq": 1,
      "place": {
        "raw": "Caernarvonshire, Wales",
        "parts": [
          "Caernarvonshire",
          "Wales"
        ],
        "lat": null,
        "lng": null
      },
      "date": {
        "raw": "25 Apr 1284",
        "year": 1284,
        "year_end": null,
        "qualifier": null
      },
      "event": "birth",
      "narrative": null,
      "confidence": "inferred",
      "sources": []
    },
    {
      "seq": 2,
      "place": {
        "raw": "Berkley, Gloucester, Gloucestershire, England",
        "parts": [
          "Berkley",
          "Gloucester",
          "Gloucestershire",
          "England"
        ],
        "lat": null,
        "lng": null
      },
      "date": {
        "raw": "21 Sep 1327",
        "year": 1327,
        "year_end": null,
        "qualifier": null
      },
      "event": "death",
      "narrative": null,
      "confidence": "inferred",
      "sources": []
    }
  ],
  "notes": null
}
