{
  "id": "I182381537282",
  "person": "Jeane Watson",
  "status": "seeded",
  "summary": null,
  "waypoints": [
    {
      "seq": 1,
      "place": {
        "raw": "Edinburgh, Scotland",
        "parts": [
          "Edinburgh",
          "Scotland"
        ],
        "lat": null,
        "lng": null
      },
      "date": {
        "raw": "22 Apr 1609",
        "year": 1609,
        "year_end": null,
        "qualifier": null
      },
      "event": "birth",
      "narrative": null,
      "confidence": "inferred",
      "sources": []
    },
    {
      "seq": 2,
      "place": {
        "raw": "Edinburgh, Midlothian, Scotland",
        "parts": [
          "Edinburgh",
          "Midlothian",
          "Scotland"
        ],
        "lat": null,
        "lng": null
      },
      "date": {
        "raw": "Abt. 1670",
        "year": 1670,
        "year_end": null,
        "qualifier": null
      },
      "event": "death",
      "narrative": null,
      "confidence": "inferred",
      "sources": []
    }
  ],
  "notes": null
}
