{
  "id": "I182541959564",
  "person": "Mary Phillips",
  "status": "seeded",
  "summary": null,
  "waypoints": [
    {
      "seq": 1,
      "place": {
        "raw": "Shalford, Colchester, Essex, England",
        "parts": [
          "Shalford",
          "Colchester",
          "Essex",
          "England"
        ],
        "lat": null,
        "lng": null
      },
      "date": {
        "raw": "1640",
        "year": 1640,
        "year_end": null,
        "qualifier": null
      },
      "event": "birth",
      "narrative": null,
      "confidence": "inferred",
      "sources": []
    },
    {
      "seq": 2,
      "place": {
        "raw": "Norfolk, Norfolk, Massachusetts, United States",
        "parts": [
          "Norfolk",
          "Norfolk",
          "Massachusetts",
          "United States"
        ],
        "lat": null,
        "lng": null
      },
      "date": {
        "raw": "1662",
        "year": 1662,
        "year_end": null,
        "qualifier": null
      },
      "event": "death",
      "narrative": null,
      "confidence": "inferred",
      "sources": []
    }
  ],
  "notes": null
}
