{
  "id": "I182620323392",
  "person": "Margaret MacDonell \\ MacDonald of Aberarder",
  "status": "seeded",
  "summary": null,
  "waypoints": [
    {
      "seq": 1,
      "place": {
        "raw": "Lochaber, Inverness-shire, Scotland",
        "parts": [
          "Lochaber",
          "Inverness-shire",
          "Scotland"
        ],
        "lat": null,
        "lng": null
      },
      "date": {
        "raw": "1754",
        "year": 1754,
        "year_end": null,
        "qualifier": null
      },
      "event": "birth",
      "narrative": null,
      "confidence": "inferred",
      "sources": []
    },
    {
      "seq": 2,
      "place": {
        "raw": "Tulluch, Perthshire, Scotland",
        "parts": [
          "Tulluch",
          "Perthshire",
          "Scotland"
        ],
        "lat": null,
        "lng": null
      },
      "date": {
        "raw": "17 Sep 1804",
        "year": 1804,
        "year_end": null,
        "qualifier": null
      },
      "event": "death",
      "narrative": null,
      "confidence": "inferred",
      "sources": []
    }
  ],
  "notes": null
}
