{
  "id": "I182726545366",
  "person": "William Denison",
  "status": "seeded",
  "summary": null,
  "waypoints": [
    {
      "seq": 1,
      "place": {
        "raw": "Thorley, Hampshire, England, United Kingdom",
        "parts": [
          "Thorley",
          "Hampshire",
          "England",
          "United Kingdom"
        ],
        "lat": null,
        "lng": null
      },
      "date": {
        "raw": "1542",
        "year": 1542,
        "year_end": null,
        "qualifier": null
      },
      "event": "birth",
      "narrative": null,
      "confidence": "documented",
      "sources": [
        {
          "source_id": "S446914557",
          "page": "Ancestry Family Tree"
        }
      ]
    },
    {
      "seq": 2,
      "place": {
        "raw": "Bishop's Stortford, Hertfordshire, England, United Kingdom",
        "parts": [
          "Bishop's Stortford",
          "Hertfordshire",
          "England",
          "United Kingdom"
        ],
        "lat": null,
        "lng": null
      },
      "date": {
        "raw": "4 December 1582",
        "year": 1582,
        "year_end": null,
        "qualifier": null
      },
      "event": "death",
      "narrative": null,
      "confidence": "documented",
      "sources": [
        {
          "source_id": "S446914557",
          "page": "Ancestry Family Tree"
        }
      ]
    }
  ],
  "notes": null
}
